{
  "version": "frame_manifest.v1",
  "job_id": "example-job",
  "stage": "frame",
  "source_video": "sandbox/output/example-job/final.mp4",
  "fps": 30,
  "sample_times_sec": [
    0.0,
    6.0,
    11.8
  ],
  "frames": [
    "sandbox/output/example-job/frames/frame_0001.png",
    "sandbox/output/example-job/frames/frame_0002.png",
    "sandbox/output/example-job/frames/frame_0003.png"
  ],
  "frame_count": 3,
  "hashes": {
    "frame_0001.png": "aaaaaaaaaaaaaaaaaaaaaaaaaaaaaaaaaaaaaaaaaaaaaaaaaaaaaaaaaaaaaaaa",
    "frame_0002.png": "bbbbbbbbbbbbbbbbbbbbbbbbbbbbbbbbbbbbbbbbbbbbbbbbbbbbbbbbbbbbbbbb",
    "frame_0003.png": "cccccccccccccccccccccccccccccccccccccccccccccccccccccccccccccccc"
  }
}

